### ISSUE TITLE
Constant flow of checksum errors

### ISSUE THREAD

**Issue by therealbubbasour** [flannel-io/flannel#1312]
Hi friends,

I'm using K3s on Ubuntu 18.04 and noticed the following storm of checksum errors while doing a tcpdump in my cluster. It seems to be the traffic across the tunnels, but I'm not 100pct sure.
The dump below was captured on my master. The cluster has 5 nodes.

Would appreciate any ideas on how to fix this.

$ kubectl version
Client Version: version.Info{Major:"1", Minor:"18", GitVersion:"v1.18.4+k3s1", GitCommit:"97b7a0e9df2883f08028fb7171c1e62fc1899a0c", GitTreeState:"clean", BuildDate:"2020-06-18T01:30:45Z", GoVersion:"go1.13.11", Compiler:"gc", Platform:"linux/amd64"}
Server Version: version.Info{Major:"1", Minor:"18", GitVersion:"v1.18.4+k3s1", GitCommit:"97b7a0e9df2883f08028fb7171c1e62fc1899a0c", GitTreeState:"clean", BuildDate:"2020-06-18T01:30:45Z", GoVersion:"go1.13.11", Compiler:"gc", Platform:"linux/amd64"}

```
20:57:39.341682 IP (tos 0x0, ttl 64, id 41297, offset 0, flags [DF], proto TCP (6), length 52)
    127.0.0.1.49930 > 127.0.0.1.6444: Flags [.], cksum 0xfe28 (incorrect -> 0x100f), ack 17587, win 512, options [nop,nop,TS val 3809442731 ecr 3809442731], length 0
20:57:39.366659 IP (tos 0x0, ttl 64, id 36868, offset 0, flags [DF], proto TCP (6), length 52)
    127.0.0.1.34962 > 127.0.0.1.6443: Flags [.], cksum 0xfe28 (incorrect -> 0x0f94), ack 4142865224, win 512, options [nop,nop,TS val 3809442756 ecr 3809412036], length 0
20:57:39.366764 IP (tos 0x0, ttl 64, id 1798, offset 0, flags [DF], proto TCP (6), length 52)
    127.0.0.1.6443 > 127.0.0.1.34962: Flags [.], cksum 0xfe28 (incorrect -> 0x1f93), ack 1, win 512, options [nop,nop,TS val 3809442756 ecr 3809407940], length 0
20:57:39.373730 IP (tos 0x0, ttl 64, id 50757, offset 0, flags [DF], proto TCP (6), length 80)
    172.16.1.203.43200 > 172.16.1.101.6443: Flags [P.], cksum 0x5b93 (incorrect -> 0x0cb5), seq 3321471082:3321471110, ack 795820311, win 501, options [nop,nop,TS val 3301275227 ecr 3668106122], length 28
20:57:39.374280 IP (tos 0x0, ttl 64, id 32162, offset 0, flags [DF], proto TCP (6), length 76)
    172.16.1.101.6443 > 172.16.1.203.43200: Flags [P.], cksum 0x5b8f (incorrect -> 0xcb29), seq 1:25, ack 28, win 501, options [nop,nop,TS val 3668111121 ecr 3301275227], length 24
20:57:39.374778 IP (tos 0x0, ttl 64, id 50758, offset 0, flags [DF], proto TCP (6), length 52)
    172.16.1.203.43200 > 172.16.1.101.6443: Flags [.], cksum 0x5b77 (incorrect -> 0x7b95), ack 25, win 501, options [nop,nop,TS val 3301275229 ecr 3668111121], length 0
20:57:39.384911 IP (tos 0x0, ttl 64, id 18813, offset 0, flags [DF], proto TCP (6), length 1369)
    10.42.0.6.37440 > 10.43.0.1.443: Flags [P.], cksum 0x19a7 (incorrect -> 0x603c), seq 3281:4598, ack 2031, win 502, options [nop,nop,TS val 1850076792 ecr 1089963436], length 1317
20:57:39.384911 IP (tos 0x0, ttl 64, id 18813, offset 0, flags [DF], proto TCP (6), length 1369)
    10.42.0.6.37440 > 172.16.1.101.6443: Flags [P.], cksum 0xbcf0 (incorrect -> 0xa582), seq 3281:4598, ack 2031, win 502, options [nop,nop,TS val 1850076792 ecr 1089963436], length 1317
20:57:39.391222 IP (tos 0x0, ttl 64, id 25792, offset 0, flags [DF], proto TCP (6), length 1067)
    10.43.0.1.443 > 10.42.0.6.37440: Flags [P.], cksum 0x1879 (incorrect -> 0x8694), seq 2031:3046, ack 4598, win 501, options [nop,nop,TS val 1089965444 ecr 1850076792], length 1015
20:57:39.391243 IP (tos 0x0, ttl 64, id 25792, offset 0, flags [DF], proto TCP (6), length 1067)
    10.43.0.1.443 > 10.42.0.6.37440: Flags [P.], cksum 0x1879 (incorrect -> 0x8694), seq 2031:3046, ack 4598, win 501, options [nop,nop,TS val 1089965444 ecr 1850076792], length 1015
20:57:39.391295 IP (tos 0x0, ttl 64, id 18814, offset 0, flags [DF], proto TCP (6), length 52)
    10.42.0.6.37440 > 10.43.0.1.443: Flags [.], cksum 0x1482 (incorrect -> 0xf5b4), ack 3046, win 502, options [nop,nop,TS val 1850076798 ecr 1089965444], length 0
20:57:39.391295 IP (tos 0x0, ttl 64, id 18814, offset 0, flags [DF], proto TCP (6), length 52)
    10.42.0.6.37440 > 172.16.1.101.6443: Flags [.], cksum 0xb7cb (incorrect -> 0x3afb), ack 3046, win 502, options [nop,nop,TS val 1850076798 ecr 1089965444], length 0
20:57:39.392261 IP (tos 0x0, ttl 64, id 18815, offset 0, flags [DF], proto TCP (6), length 2016)
    10.42.0.6.37440 > 10.43.0.1.443: Flags [P.], cksum 0x1c2e (incorrect -> 0xf56b), seq 4598:6562, ack 3046, win 502, options [nop,nop,TS val 1850076799 ecr 1089965444], length 1964
20:57:39.392261 IP (tos 0x0, ttl 64, id 18815, offset 0, flags [DF], proto TCP (6), length 2016)
    10.42.0.6.37440 > 172.16.1.101.6443: Flags [P.], cksum 0xbf77 (incorrect -> 0x3ab2), seq 4598:6562, ack 3046, win 502, options [nop,nop,TS val 1850076799 ecr 1089965444], length 1964
20:57:39.392310 IP (tos 0x0, ttl 64, id 41298, offset 0, flags [DF], proto TCP (6), length 90)
    127.0.0.1.49930 > 127.0.0.1.6444: Flags [P.], cksum 0xfe4e (incorrect -> 0xb82b), seq 2103:2141, ack 17587, win 512, options [nop,nop,TS val 3809442781 ecr 3809442731], length 38
20:57:39.392869 IP (tos 0x0, ttl 64, id 25793, offset 0, flags [DF], proto TCP (6), length 52)
    10.43.0.1.443 > 10.42.0.6.37440: Flags [.], cksum 0x1482 (incorrect -> 0xee06), ack 6562, win 501, options [nop,nop,TS val 1089965446 ecr 1850076799], length 0
20:57:39.392899 IP (tos 0x0, ttl 64, id 25793, offset 0, flags [DF], proto TCP (6), length 52)
    10.43.0.1.443 > 10.42.0.6.37440: Flags [.], cksum 0x1482 (incorrect -> 0xee06), ack 6562, win 501, options [nop,nop,TS val 1089965446 ecr 1850076799], length 0
20:57:39.398086 IP (tos 0x0, ttl 64, id 15698, offset 0, flags [DF], proto TCP (6), length 88)
    127.0.0.1.6444 > 127.0.0.1.49930: Flags [P.], cksum 0xfe4c (incorrect -> 0x7703), seq 17587:17623, ack 2141, win 512, options [nop,nop,TS val 3809442787 ecr 3809442781], length 36
```

**Comment by therealbubbasour** [comment]
I've changed backend to host-gw and the problem seem to be gone for now.

**Comment by sirishbandi** [comment]
[#92035](https://github.com/kubernetes/kubernetes/pull/92035) ?
