### ISSUE TITLE
k8s packets dropped between flannel.1 and cni0, no connectivity between hosts

### ISSUE THREAD

**Issue by Xnyle** [flannel-io/flannel#1473]
K8S 1.21 on Debian 11 KVM cluster running kernel 5.10

I have other clusters running the same setup on kernel 4.19 with Debian 10 that work just fine

Issue is, Packets from VM 1 go through flannel interface, appear on the correct VM 0 and then get dropped/ignored for some reason.

I'm not even sure if that's a flannel problem but I have to start somewhere:
Testcase is a DNS request from VM-1 to the kube-dns inside VM-0
Tcpdump outputs are from VM-0 

tcpdump -i any 'port 53 and (dst 10.244.0.3 or src 10.244.0.3 )' # on VM-0  that has flannel.1 address 10.244.0.1 and the kube-dns pod running at 10.96.0.10

dig @10.244.0.3 google.com # on VM-1 that has flannel.1 address 10.244.1.1 

12:36:20.500746 flannel.1 P   IP 10.244.1.0.56906 > 10.244.0.3.domain: 24335+ [1au] A? google.com. (51)
12:36:25.503547 flannel.1 P   IP 10.244.1.0.56906 > 10.244.0.3.domain: 24335+ [1au] A? google.com. (51)
12:36:30.507618 flannel.1 P   IP 10.244.1.0.56906 > 10.244.0.3.domain: 24335+ [1au] A? google.com. (51)

PROBLEM: packets seem to get dropped and not forwarded to cni0
Packets reach the correct VM-0 so flannel is working (sort of) but packets are not sent out to the pods via cni0.
QUESTION why? 
There are no firewall rules (i even deleted all KUBE DROP rules just to be sure)
cat /proc/sys/net/ipv4/ip_forward = 1

FOR COMPARISON:
the same on another vm cluster, kube-dns is at 10.244.0.4 here, first dig request again from another vm
dig @10.244.0.4 google.com # on VM-1 that has flannel.1 address 10.244.1.1

12:58:43.340068 flannel.1 In  IP 10.244.1.0.36651 > 10.244.0.4.domain: 36999+ [1au] A? google.com. (51)
12:58:43.340088 cni0  Out IP 10.244.1.0.36651 > 10.244.0.4.domain: 36999+ [1au] A? google.com. (51)
12:58:43.340095 vethbcd24e9c Out IP 10.244.1.0.36651 > 10.244.0.4.domain: 36999+ [1au] A? google.com. (51)
12:58:43.340463 vethbcd24e9c P   IP 10.244.0.4.56648 > vm-master.domain: 36999+ [1au] A? google.com. (51)
12:58:43.340480 cni0  In  IP 10.244.0.4.56648 > vm-master.domain: 36999+ [1au] A? google.com. (51)
12:58:43.390530 cni0  Out IP vm-master.domain > 10.244.0.4.56648: 36999 1/0/1 A 142.251.37.14 (55)
12:58:43.390539 vethbcd24e9c Out IP vm-master.domain > 10.244.0.4.56648: 36999 1/0/1 A 142.251.37.14 (55)
12:58:43.390968 vethbcd24e9c P   IP 10.244.0.4.domain > 10.244.1.0.36651: 36999 1/0/1 A 142.251.37.14 (65)
12:58:43.390995 cni0  In  IP 10.244.0.4.domain > 10.244.1.0.36651: 36999 1/0/1 A 142.251.37.14 (65)
12:58:43.391012 flannel.1 Out IP 10.244.0.4.domain > 10.244.1.0.36651: 36999 1/0/1 A 142.251.37.14 (65)

Additinal Tests:
Requests from the same node work on both clusters

dig @10.244.0.3 google.com # on the vm that has flannel.1 address 10.244.0.1, the same vm here the kube-dns is on

12:36:33.245144 cni0  Out IP 10.244.0.1.59818 > 10.244.0.3.domain: 2891+ [1au] A? google.com. (51)
12:36:33.245149 veth0f938dcf Out IP 10.244.0.1.59818 > 10.244.0.3.domain: 2891+ [1au] A? google.com. (51)
12:36:33.245329 veth0f938dcf P   IP 10.244.0.3.59649 > vm-master.domain: 2891+ [1au] A? google.com. (51)
12:36:33.245329 cni0  In  IP 10.244.0.3.59649 > vm-master.domain: 2891+ [1au] A? google.com. (51)
12:36:33.245508 cni0  Out IP vm-master.domain > 10.244.0.3.59649: 2891 1/0/1 A 172.217.18.110 (83)
12:36:33.245509 veth0f938dcf Out IP vm-master.domain > 10.244.0.3.59649: 2891 1/0/1 A 172.217.18.110 (83)
12:36:33.245555 veth0f938dcf P   IP 10.244.0.3.domain > 10.244.0.1.59818: 2891 1/0/1 A 172.217.18.110 (93)
12:36:33.245555 cni0  In  IP 10.244.0.3.domain > 10.244.0.1.59818: 2891 1/0/1 A 172.217.18.110 (93)

dig @10.244.0.4 google.com # on VM-0 that has flannel.1 address 10.244.0.1, the same vm here the kube-dns is on

13:00:13.406823 cni0  Out IP 10.244.0.1.56414 > 10.244.0.4.domain: 16036+ [1au] A? google.co. (50)
13:00:13.406831 vethbcd24e9c Out IP 10.244.0.1.56414 > 10.244.0.4.domain: 16036+ [1au] A? google.co. (50)
13:00:13.407139 vethbcd24e9c P   IP 10.244.0.4.38402 > vm-master.domain: 16036+ [1au] A? google.co. (50)
13:00:13.407139 cni0  In  IP 10.244.0.4.38402 > vm-master.domain: 16036+ [1au] A? google.co. (50)
13:00:13.434731 cni0  Out IP vm-master.domain > 10.244.0.4.38402: 16036 1/0/1 A 142.251.36.238 (54)
13:00:13.434742 vethbcd24e9c Out IP vm-master.domain > 10.244.0.4.38402: 16036 1/0/1 A 142.251.36.238 (54)
13:00:13.435042 vethbcd24e9c P   IP 10.244.0.4.domain > 10.244.0.1.56414: 16036 1/0/1 A 142.251.36.238 (63)
13:00:13.435042 cni0  In  IP 10.244.0.4.domain > 10.244.0.1.56414: 16036 1/0/1 A 142.251.36.238 (63)

**Comment by yuanying** [comment]
I also have same issue, but ubuntu 20.04 /w kernel 5.4.0-81-generic is work.

BTW, I can fix this issue by using `kubectl delete pod -n kube-system -l app=flannel` command, mentioned at https://github.com/flannel-io/flannel/issues/1474#issuecomment-907950626
Is this same problem?

```
ubuntu@ubuntu-worker01:~$ cat /etc/os-release
NAME="Ubuntu"
VERSION="21.04 (Hirsute Hippo)"
ID=ubuntu
ID_LIKE=debian
PRETTY_NAME="Ubuntu 21.04"
VERSION_ID="21.04"
HOME_URL="https://www.ubuntu.com/"
SUPPORT_URL="https://help.ubuntu.com/"
BUG_REPORT_URL="https://bugs.launchpad.net/ubuntu/"
PRIVACY_POLICY_URL="https://www.ubuntu.com/legal/terms-and-policies/privacy-policy"
VERSION_CODENAME=hirsute
UBUNTU_CODENAME=hirsute
ubuntu@ubuntu-worker01:~$ uname -a
Linux ubuntu-worker01 5.11.0-31-generic #33-Ubuntu SMP Wed Aug 11 13:19:04 UTC 2021 x86_64 x86_64 x86_64 GNU/Linux
```

**Comment by pilou-** [comment]
I encounter the same issue using k3s with two nodes (flannel: v0.14.0, k3s: `v1.21.4+k3s1 (3e250fdb)`, Debian 11, kernel `5.10.0-8-amd64 #1 SMP Debian 5.10.46-4 (2021-08-03) x86_64`). This issue didn't occur with Debian 10, flannel v0.12.0 and a previous k3s release.

I can workaround this issue by using `sudo killall flanneld` on both nodes (deleting the pod works too).

It looks like flanneld isn't using the right VTEP MAC address (on both nodes).
```
$ kubectl logs -n kube-system kube-flannel-ds-node1 | grep -E '(calling|adding) | cut -c 31-
vxlan_network.go:139] adding subnet: 10.244.1.0/24 PublicIP: <redacted> VtepMAC: fe:06:04:ca:6d:1e
device.go:160] calling AddARP: 10.244.1.0, fe:06:04:ca:6d:1e
device.go:137] calling AddFDB: <redacted> fe:06:04:ca:6d:1e
```
`fe:06:04:ca:6d:1e` is used but on `node2` the mac address differs:
<pre>
$ ip l show flannel.1
4: flannel.1: <BROADCAST,MULTICAST,UP,LOWER_UP> mtu 1450 qdisc noqueue state UNKNOWN mode DEFAULT group default 
    link/ether 76:a5:88:e1:1f:93 brd ff:ff:ff:ff:ff:ff
</pre>

I can workaround this issue without killing flanneld using the following commands on both nodes:
<pre>
VTEP_MAC=$(ssh othernode ip -j a s flannel.1 | jq -r .[0].address) # fetch VTEP MAC address from other node
FLANNEL_NET=$(ssh othernode ip -j a s flannel.1 | jq -r '.[0].addr_info[] | select(.family == "inet").local') # fetch flannel network
PUBLIC_IP=$(ssh othernode ip -j r s default | jq -r .[0].gateway) # Public IP of the other node

# Create a static ARP entry for the remote flannel host IP address (and the VTEP MAC)
sudo arp -v -H ether -i flannel.1 -d ${FLANNEL_NET} 
sudo arp -v -H ether -i flannel.1 -s ${FLANNEL_NET} ${VTEP_MAC} 

# Create an FDB entry with the VTEP MAC and the public IP of the remote flannel daemon
sudo bridge fdb add ${VTEP_MAC} dev flannel.1 dst ${PUBLIC_IP} self 
</pre>

**Comment by pilou-** [comment]
I was able to reproduce the issue with a 4.9 Linux kernel and several previous versions of flanneld. It looks like [ensureLink](https://github.com/flannel-io/flannel/blob/fca1560c91cc44f3c15355b0c2de431a2b7dbf23/backend/vxlan/device.go#L72) doesn't see the `flannel.1` interface and doesn't return `EEXIST` when it should?!?
Using `k3s version v1.20.10+k3s1 (fedc68f7)` (5.10 kernel, flannel plugin v0.9.1, flanneld v0.14.0) the problem doesn't occur.

**Comment by pilou-** [comment]
I was able to reproduce the issue with a 4.9 Linux kernel / several previous versions of flanneld / k3s `v1.20.10+k3s1 (fedc68f7)`. It looks like [ensureLink](https://github.com/flannel-io/flannel/blob/fca1560c91cc44f3c15355b0c2de431a2b7dbf23/backend/vxlan/device.go#L72) doesn't see the `flannel.1` interface and doesn't return `EEXIST` when it should?!?
