### ISSUE TITLE
Unable to connect to kubernetes.default.svc from pods

### ISSUE THREAD

**Issue by ImNtReal** [flannel-io/flannel#1661]
Let me start by saying, I'm not actually sure if this is a flannel issue, or if the problem lies elsewhere, but I'm not sure where else to start.

## Expected Behavior
curl -k https://kubernetes.default.svc/api from a pod in the cluster returns data

## Current Behavior
curl -k https://kubernetes.default.svc/api from a pod in the cluster returns connection refused

## Steps to Reproduce (for bugs)
1. kubectl run tmp-shell --rm -i --tty --image nicolaka/netshoot
2. curl -k https://kubernetes.default.svc/api
3. get connection refused
I am able to connect to other ClusterIP services from this pod.

## Context
The biggest issue it's causing me is that AWX is unable to create pods. I am able to connect to the API service externally through kube-vip, just not from inside the cluster.

## Your Environment
* Flannel version: CNI Plugin flannel version v1.1.0
* Backend used (e.g. vxlan or udp): vxlan
* Etcd version: 3.5.4
* Kubernetes version (if used): v1.25.2
* Operating System and version: Clear Linux

Please, let me know what other information will be helpful in troubleshooting this, or if I should take the issue elsewhere. Thanks.

**Comment by rbrtbnfgl** [comment]
I think you have to configure a serviceAccount for that pod to be able to communicate with the kube-api server.

**Comment by ImNtReal** [comment]
Would a service account be required to reach the web service of the API service? I'm getting connection refused, not forbidden.

**Comment by ImNtReal** [comment]
``` ~> kubectl get serviceaccount -n awx awx -o yaml
apiVersion: v1
kind: ServiceAccount
metadata:
  annotations:
    kubectl.kubernetes.io/last-applied-configuration: '{"apiVersion":"v1","kind":"ServiceAccount","metadata":{"labels":{"app.kubernetes.io/component":"awx","app.kubernetes.io/managed-by":"awx-operator","app.kubernetes.io/name":"awx","app.kubernetes.io/operator-version":"0.30.0","app.kubernetes.io/part-of":"awx"},"name":"awx","namespace":"awx"}}'
  creationTimestamp: "2022-10-13T15:38:11Z"
  labels:
    app.kubernetes.io/component: awx
    app.kubernetes.io/managed-by: awx-operator
    app.kubernetes.io/name: awx
    app.kubernetes.io/operator-version: 0.30.0
    app.kubernetes.io/part-of: awx
  name: awx
  namespace: awx
  ownerReferences:
  - apiVersion: awx.ansible.com/v1beta1
    kind: AWX
    name: awx
    uid: 5cfe73ab-773c-4f28-97fb-859a523ea8d6
  resourceVersion: "4399944"
  uid: 3aa20d69-ee82-45c5-9751-e2f2a1bd2209```

**Comment by ImNtReal** [comment]
I am using an ingress controller to get to AWX, but the Kubernetes API service is exposed via kube-vip.

Worker node iptables:
```
Chain INPUT (policy ACCEPT)
target     prot opt source               destination
KUBE-PROXY-FIREWALL  all  --  anywhere             anywhere             /* kube-proxy firewall rules */
KUBE-NODE-PORT  all  --  anywhere             anywhere             /* kubernetes health check rules */
KUBE-FIREWALL  all  --  anywhere             anywhere
DROP       all  --  anywhere             anywhere             match-set tallow src

Chain FORWARD (policy ACCEPT)
target     prot opt source               destination
KUBE-PROXY-FIREWALL  all  --  anywhere             anywhere             /* kube-proxy firewall rules */
KUBE-FORWARD  all  --  anywhere             anywhere             /* kubernetes forwarding rules */
ACCEPT     all  --  10.244.0.0/16        anywhere             /* flanneld forward */
ACCEPT     all  --  anywhere             10.244.0.0/16        /* flanneld forward */

Chain OUTPUT (policy ACCEPT)
target     prot opt source               destination
KUBE-FIREWALL  all  --  anywhere             anywhere

Chain KUBE-FIREWALL (2 references)
target     prot opt source               destination
DROP       all  -- !localhost/8          localhost/8          /* block incoming localnet connections */ ! ctstate RELATED,ESTABLISHED,DNAT
DROP       all  --  anywhere             anywhere             /* kubernetes firewall for dropping marked packets */ mark match 0x8000/0x8000

Chain KUBE-FORWARD (1 references)
target     prot opt source               destination
ACCEPT     all  --  anywhere             anywhere             /* kubernetes forwarding rules */ mark match 0x4000/0x4000
ACCEPT     all  --  anywhere             anywhere             /* kubernetes forwarding conntrack rule */ ctstate RELATED,ESTABLISHED

Chain KUBE-KUBELET-CANARY (0 references)
target     prot opt source               destination

Chain KUBE-NODE-PORT (1 references)
target     prot opt source               destination
ACCEPT     all  --  anywhere             anywhere             /* Kubernetes health check node port */ match-set KUBE-HEALTH-CHECK-NODE-PORT dst

Chain KUBE-PROXY-FIREWALL (2 references)
target     prot opt source               destination

Chain KUBE-SOURCE-RANGES-FIREWALL (0 references)
target     prot opt source               destination
DROP       all  --  anywhere             anywhere
```

**Comment by ImNtReal** [comment]
iptables for one control-plane node:
```
Chain INPUT (policy ACCEPT)
target     prot opt source               destination
KUBE-PROXY-FIREWALL  all  --  anywhere             anywhere             /* kube-proxy firewall rules */
KUBE-NODE-PORT  all  --  anywhere             anywhere             /* kubernetes health check rules */
KUBE-FIREWALL  all  --  anywhere             anywhere
DROP       all  --  anywhere             anywhere             match-set tallow src

Chain FORWARD (policy ACCEPT)
target     prot opt source               destination
KUBE-PROXY-FIREWALL  all  --  anywhere             anywhere             /* kube-proxy firewall rules */
KUBE-FORWARD  all  --  anywhere             anywhere             /* kubernetes forwarding rules */
ACCEPT     all  --  vminkube01.nghs.com/16  anywhere             /* flanneld forward */
ACCEPT     all  --  anywhere             vminkube01.nghs.com/16  /* flanneld forward */

Chain OUTPUT (policy ACCEPT)
target     prot opt source               destination
KUBE-FIREWALL  all  --  anywhere             anywhere

Chain KUBE-FIREWALL (2 references)
target     prot opt source               destination
DROP       all  -- !localhost/8          localhost/8          /* block incoming localnet connections */ ! ctstate RELATED,ESTABLISHED,DNAT
DROP       all  --  anywhere             anywhere             /* kubernetes firewall for dropping marked packets */ mark match 0x8000/0x8000

Chain KUBE-FORWARD (1 references)
target     prot opt source               destination
ACCEPT     all  --  anywhere             anywhere             /* kubernetes forwarding rules */ mark match 0x4000/0x4000
ACCEPT     all  --  anywhere             anywhere             /* kubernetes forwarding conntrack rule */ ctstate RELATED,ESTABLISHED

Chain KUBE-KUBELET-CANARY (0 references)
target     prot opt source               destination

Chain KUBE-NODE-PORT (1 references)
target     prot opt source               destination
ACCEPT     all  --  anywhere             anywhere             /* Kubernetes health check node port */ match-set KUBE-HEALTH-CHECK-NODE-PORT dst

Chain KUBE-PROXY-FIREWALL (2 references)
target     prot opt source               destination

Chain KUBE-SOURCE-RANGES-FIREWALL (0 references)
target     prot opt source               destination
DROP       all  --  anywhere             anywhere
```

**Comment by ImNtReal** [comment]
It appears it may be related to something wrong with particular nodes. Since this is all that's currently running on my cluster, I drained two of my three worker nodes, and it appears that on the third, it's able to reach the API service.

**Comment by ImNtReal** [comment]
I take that back. I'm not sure if it's node specific. Looking, again, it's only working one out of three tries, so I'm really confused about where the problem is.

**Comment by rbrtbnfgl** [comment]
Could it be some firewall configured on the network?

**Comment by ImNtReal** [comment]
There isn't a firewall between any of the nodes. They are all on the same VMware virtual network (no NSX or the like). I've gone as far as draining all but one worker node, and one control-plane node. Still it seems to work only 1/3 tries.

**Comment by ImNtReal** [comment]
Another strange thing is that running mtr from inside a pod, there aren't any ICMP packets being dropped between the pod and kubernetes.default.svc, but I'm still getting connection refused 2/3 tries. I wonder if something is actually up with kube-apiserver.

**Comment by ImNtReal** [comment]
I've tried deleting CNI plugins, including flanneld on each node, and installing the latest versions. I've also deleted my flannel daemon sets, and re-installed the latest manifest. Then, I wrote this inside a pod to test:
```
#! /bin/bash

while true; do
  sleep 5
  curl -k https://kubernetes.default.svc/api
done
```

It appears that I'm now down to failures 1/3 instead of 2/3. Here's what I got while testing:
```
 tmp-shell  ~  ./test.sh
curl: (7) Failed to connect to kubernetes.default.svc port 443 after 2 ms: Connection refused
{
  "kind": "Status",
  "apiVersion": "v1",
  "metadata": {},
  "status": "Failure",
  "message": "forbidden: User \"system:anonymous\" cannot get path \"/api\"",
  "reason": "Forbidden",
  "details": {},
  "code": 403
}{
  "kind": "Status",
  "apiVersion": "v1",
  "metadata": {},
  "status": "Failure",
  "message": "forbidden: User \"system:anonymous\" cannot get path \"/api\"",
  "reason": "Forbidden",
  "details": {},
  "code": 403
}curl: (7) Failed to connect to kubernetes.default.svc port 443 after 2 ms: Connection refused
{
  "kind": "Status",
  "apiVersion": "v1",
  "metadata": {},
  "status": "Failure",
  "message": "forbidden: User \"system:anonymous\" cannot get path \"/api\"",
  "reason": "Forbidden",
  "details": {},
  "code": 403
}{
  "kind": "Status",
  "apiVersion": "v1",
  "metadata": {},
  "status": "Failure",
  "message": "forbidden: User \"system:anonymous\" cannot get path \"/api\"",
  "reason": "Forbidden",
  "details": {},
  "code": 403
}curl: (7) Failed to connect to kubernetes.default.svc port 443 after 2 ms: Connection refused
{
  "kind": "Status",
  "apiVersion": "v1",
  "metadata": {},
  "status": "Failure",
  "message": "forbidden: User \"system:anonymous\" cannot get path \"/api\"",
  "reason": "Forbidden",
  "details": {},
  "code": 403
}{
  "kind": "Status",
  "apiVersion": "v1",
  "metadata": {},
  "status": "Failure",
  "message": "forbidden: User \"system:anonymous\" cannot get path \"/api\"",
  "reason": "Forbidden",
  "details": {},
  "code": 403
}curl: (7) Failed to connect to kubernetes.default.svc port 443 after 2 ms: Connection refused
{
  "kind": "Status",
  "apiVersion": "v1",
  "metadata": {},
  "status": "Failure",
  "message": "forbidden: User \"system:anonymous\" cannot get path \"/api\"",
  "reason": "Forbidden",
  "details": {},
  "code": 403
}{
  "kind": "Status",
  "apiVersion": "v1",
  "metadata": {},
  "status": "Failure",
  "message": "forbidden: User \"system:anonymous\" cannot get path \"/api\"",
  "reason": "Forbidden",
  "details": {},
  "code": 403
}
```

I'm still able to send ICMP packets to the address with no failures.

**Comment by rbrtbnfgl** [comment]
but the connection to the api server seems to work fine. You have to check the service log because the server it's replying with forbidden.

**Comment by ImNtReal** [comment]
The forbidden responses aren't the problem. The problem is:
```
curl: (7) Failed to connect to kubernetes.default.svc port 443 after 2 ms: Connection refused
```

**Comment by rbrtbnfgl** [comment]
Could you check the core usage on the node with the service? It could be the server that is not responding on high cpu usage.

**Comment by ImNtReal** [comment]
```
kubectl get pods -n kube-system | grep kube-api
kube-apiserver-vminkube01.nghs.com            1/1     Running   16 (50m ago)   16d
kube-apiserver-vminkube02.nghs.com            1/1     Running   8 (51m ago)    16d
kube-apiserver-vminkube03.nghs.com            1/1     Running   10 (53m ago)   16d
```

```
Linux 6.0.2-1201.native (vminkube01.nghs.com)   10/20/22        _x86_64_        (4 CPU)

15:10:49     CPU    %usr   %nice    %sys %iowait    %irq   %soft  %steal  %guest  %gnice   %idle
15:10:49     all    1.80    0.00    0.77    0.21    0.28    0.17    0.00    0.00    0.00   96.78
Connection to vminkube01.nghs.com closed.
vminkube02.nghs.com
Linux 6.0.2-1201.native (vminkube02.nghs.com)   10/20/22        _x86_64_        (8 CPU)

15:10:50     CPU    %usr   %nice    %sys %iowait    %irq   %soft  %steal  %guest  %gnice   %idle
15:10:50     all    0.79    0.00    0.48    0.11    0.21    0.10    0.00    0.00    0.00   98.30
Connection to vminkube02.nghs.com closed.
vminkube03.nghs.com
Linux 6.0.2-1201.native (vminkube03.nghs.com)   10/20/22        _x86_64_        (8 CPU)

15:10:50     CPU    %usr   %nice    %sys %iowait    %irq   %soft  %steal  %guest  %gnice   %idle
15:10:50     all    0.74    0.00    0.45    0.11    0.16    0.10    0.00    0.00    0.00   98.43
Connection to vminkube03.nghs.com closed.
```

**Comment by ImNtReal** [comment]
One interesting difference between my control plane nodes is that I just discovered that the first node has this in iptables rules:
```
ACCEPT     all  --  vminkube01.nghs.com/16  anywhere             /* flanneld forward */
ACCEPT     all  --  anywhere             vminkube01.nghs.com/16  /* flanneld forward */
```

The other two have this:
```
ACCEPT     all  --  10.244.0.0/16        anywhere             /* flanneld forward */
ACCEPT     all  --  anywhere             10.244.0.0/16        /* flanneld forward */
```

**Comment by rbrtbnfgl** [comment]
what are the IPs of the nodes? Maybe you got a collision with the IPs

**Comment by ImNtReal** [comment]
```
vminkube01 ~> ip a
1: lo: <LOOPBACK,UP,LOWER_UP> mtu 65536 qdisc noqueue state UNKNOWN group default qlen 1000
    link/loopback 00:00:00:00:00:00 brd 00:00:00:00:00:00
    inet 127.0.0.1/8 scope host lo
       valid_lft forever preferred_lft forever
    inet6 ::1/128 scope host
       valid_lft forever preferred_lft forever
2: ens192: <BROADCAST,MULTICAST,UP,LOWER_UP> mtu 1500 qdisc mq state UP group default qlen 1000
    link/ether 00:50:56:97:a3:df brd ff:ff:ff:ff:ff:ff
    altname enp11s0
    inet 172.16.73.16/23 brd 172.16.73.255 scope global ens192
       valid_lft forever preferred_lft forever
    inet 172.16.73.70/32 scope global ens192
       valid_lft forever preferred_lft forever
    inet 172.16.73.21/32 scope global ens192
       valid_lft forever preferred_lft forever
3: kube-ipvs0: <BROADCAST,NOARP> mtu 1500 qdisc noop state DOWN group default
    link/ether 7a:eb:0a:e3:a6:13 brd ff:ff:ff:ff:ff:ff
    inet 10.245.0.10/32 scope global kube-ipvs0
       valid_lft forever preferred_lft forever
    inet 10.245.25.185/32 scope global kube-ipvs0
       valid_lft forever preferred_lft forever
    inet 10.245.81.225/32 scope global kube-ipvs0
       valid_lft forever preferred_lft forever
    inet 172.16.73.70/32 scope global kube-ipvs0
       valid_lft forever preferred_lft forever
    inet 10.245.18.112/32 scope global kube-ipvs0
       valid_lft forever preferred_lft forever
    inet 10.245.240.86/32 scope global kube-ipvs0
       valid_lft forever preferred_lft forever
    inet 10.245.204.79/32 scope global kube-ipvs0
       valid_lft forever preferred_lft forever
    inet 10.245.145.106/32 scope global kube-ipvs0
       valid_lft forever preferred_lft forever
    inet 10.245.0.1/32 scope global kube-ipvs0
       valid_lft forever preferred_lft forever
4: flannel.1: <BROADCAST,MULTICAST,UP,LOWER_UP> mtu 1450 qdisc noqueue state UNKNOWN group default
    link/ether 82:29:bd:24:54:a6 brd ff:ff:ff:ff:ff:ff
    inet 10.244.0.0/32 scope global flannel.1
       valid_lft forever preferred_lft forever
    inet6 fe80::8029:bdff:fe24:54a6/64 scope link
       valid_lft forever preferred_lft forever
```

**Comment by ImNtReal** [comment]
```
vminkube01 ~> host vminkube01
vminkube01.nghs.com has address 172.16.73.16
```

**Comment by ImNtReal** [comment]
```
user@vminkube01 ~> host vminkube02
vminkube02.nghs.com has address 172.16.73.17
user@vminkube01 ~> host vminkube03
vminkube03.nghs.com has address 172.16.73.18
user@vminkube01 ~> host vminkube04
vminkube04.nghs.com has address 172.16.73.19
user@vminkube01 ~> host vminkube05
vminkube05.nghs.com has address 172.16.73.52
user@vminkube01 ~> host vminkube06
vminkube06.nghs.com has address 172.16.73.53
```

**Comment by rbrtbnfgl** [comment]
`iptables-save | grep flanneld` on the first node?

**Comment by ImNtReal** [comment]
That looks more like the others:
```
user@vminkube01 ~> sudo iptables-save | grep flanneld
Password:
-A POSTROUTING -m comment --comment "flanneld masq" -j FLANNEL-POSTRTG
-A FLANNEL-POSTRTG -s 10.244.0.0/16 -d 10.244.0.0/16 -m comment --comment "flanneld masq" -j RETURN
-A FLANNEL-POSTRTG -s 10.244.0.0/16 ! -d 224.0.0.0/4 -m comment --comment "flanneld masq" -j MASQUERADE --random-fully
-A FLANNEL-POSTRTG ! -s 10.244.0.0/16 -d 10.244.0.0/24 -m comment --comment "flanneld masq" -j RETURN
-A FLANNEL-POSTRTG ! -s 10.244.0.0/16 -d 10.244.0.0/16 -m comment --comment "flanneld masq" -j MASQUERADE --random-fully
-A FORWARD -m comment --comment "flanneld forward" -j FLANNEL-FWD
-A FLANNEL-FWD -s 10.244.0.0/16 -m comment --comment "flanneld forward" -j ACCEPT
-A FLANNEL-FWD -d 10.244.0.0/16 -m comment --comment "flanneld forward" -j ACCEPT
```

**Comment by ImNtReal** [comment]
```
 tmp-shell  ~  host kubernetes.default.svc
kubernetes.default.svc.cluster.local has address 10.245.0.1
```

**Comment by rbrtbnfgl** [comment]
Can you try to capture the traffic with tcpdump to check if the packets are dropped and where? You can apply a filter based on the pod IP and port 443

**Comment by ImNtReal** [comment]
Well, I tried running this on all nodes:
```
sudo tcpdump -i flannel.1 host 10.244.5.22 and port 443
```

I'm not getting anything, whether it works or not. Without the port, I can see the DNS requests on one control-plane node.

**Comment by ImNtReal** [comment]
This is from the worker node the pod is running on:
```
user@vminkube06.nghs.com~ $ sudo tcpdump -i cni0 host 10.244.5.22 and port 443
tcpdump: verbose output suppressed, use -v[v]... for full protocol decode
listening on cni0, link-type EN10MB (Ethernet), snapshot length 262144 bytes
16:30:15.708435 IP 10.244.5.22.40014 > vminkube06.nghs.com.https: Flags [S], seq 836986822, win 64860, options [mss 1410,sackOK,TS val 9770564 ecr 0,nop,wscale 9], length 0
16:30:15.708615 IP vminkube06.nghs.com.https > 10.244.5.22.40014: Flags [S.], seq 705679455, ack 836986823, win 65160, options [mss 1460,sackOK,TS val 1569282397 ecr 9770564,nop,wscale 9], length 0
16:30:15.708646 IP 10.244.5.22.40014 > vminkube06.nghs.com.https: Flags [.], ack 1, win 127, options [nop,nop,TS val 9770564 ecr 1569282397], length 0
16:30:15.709231 IP 10.244.5.22.40014 > vminkube06.nghs.com.https: Flags [P.], seq 1:518, ack 1, win 127, options [nop,nop,TS val 9770564 ecr 1569282397], length 517
16:30:15.709401 IP vminkube06.nghs.com.https > 10.244.5.22.40014: Flags [.], ack 518, win 127, options [nop,nop,TS val 1569282398 ecr 9770564], length 0
16:30:15.712122 IP vminkube06.nghs.com.https > 10.244.5.22.40014: Flags [P.], seq 1:1633, ack 518, win 127, options [nop,nop,TS val 1569282400 ecr 9770564], length 1632
16:30:15.712149 IP 10.244.5.22.40014 > vminkube06.nghs.com.https: Flags [.], ack 1633, win 124, options [nop,nop,TS val 9770567 ecr 1569282400], length 0
16:30:15.712913 IP 10.244.5.22.40014 > vminkube06.nghs.com.https: Flags [P.], seq 518:612, ack 1633, win 126, options [nop,nop,TS val 9770568 ecr 1569282400], length 94
16:30:15.713090 IP 10.244.5.22.40014 > vminkube06.nghs.com.https: Flags [P.], seq 612:658, ack 1633, win 126, options [nop,nop,TS val 9770568 ecr 1569282400], length 46
16:30:15.713140 IP 10.244.5.22.40014 > vminkube06.nghs.com.https: Flags [P.], seq 658:707, ack 1633, win 126, options [nop,nop,TS val 9770568 ecr 1569282400], length 49
16:30:15.713171 IP vminkube06.nghs.com.https > 10.244.5.22.40014: Flags [P.], seq 1633:1785, ack 612, win 127, options [nop,nop,TS val 1569282401 ecr 9770568], length 152
16:30:15.713182 IP 10.244.5.22.40014 > vminkube06.nghs.com.https: Flags [P.], seq 707:742, ack 1633, win 126, options [nop,nop,TS val 9770568 ecr 1569282400], length 35
16:30:15.713259 IP 10.244.5.22.40014 > vminkube06.nghs.com.https: Flags [P.], seq 742:813, ack 1785, win 126, options [nop,nop,TS val 9770568 ecr 1569282401], length 71
16:30:15.713269 IP vminkube06.nghs.com.https > 10.244.5.22.40014: Flags [P.], seq 1785:1840, ack 658, win 127, options [nop,nop,TS val 1569282402 ecr 9770568], length 55
16:30:15.713343 IP vminkube06.nghs.com.https > 10.244.5.22.40014: Flags [P.], seq 1840:1875, ack 707, win 127, options [nop,nop,TS val 1569282402 ecr 9770568], length 35
16:30:15.713382 IP vminkube06.nghs.com.https > 10.244.5.22.40014: Flags [P.], seq 1875:1906, ack 742, win 127, options [nop,nop,TS val 1569282402 ecr 9770568], length 31
16:30:15.713414 IP 10.244.5.22.40014 > vminkube06.nghs.com.https: Flags [P.], seq 813:844, ack 1906, win 126, options [nop,nop,TS val 9770569 ecr 1569282402], length 31
16:30:15.713572 IP vminkube06.nghs.com.https > 10.244.5.22.40014: Flags [.], ack 844, win 127, options [nop,nop,TS val 1569282402 ecr 9770568], length 0
16:30:15.713860 IP vminkube06.nghs.com.https > 10.244.5.22.40014: Flags [P.], seq 1906:2161, ack 844, win 127, options [nop,nop,TS val 1569282402 ecr 9770568], length 255
16:30:15.713920 IP vminkube06.nghs.com.https > 10.244.5.22.40014: Flags [P.], seq 2161:2412, ack 844, win 127, options [nop,nop,TS val 1569282402 ecr 9770568], length 251
16:30:15.713973 IP 10.244.5.22.40014 > vminkube06.nghs.com.https: Flags [.], ack 2412, win 126, options [nop,nop,TS val 9770569 ecr 1569282402], length 0
16:30:15.714195 IP 10.244.5.22.40014 > vminkube06.nghs.com.https: Flags [P.], seq 844:868, ack 2412, win 126, options [nop,nop,TS val 9770569 ecr 1569282402], length 24
16:30:15.714255 IP 10.244.5.22.40014 > vminkube06.nghs.com.https: Flags [F.], seq 868, ack 2412, win 126, options [nop,nop,TS val 9770569 ecr 1569282402], length 0
16:30:15.714390 IP vminkube06.nghs.com.https > 10.244.5.22.40014: Flags [P.], seq 2412:2436, ack 868, win 127, options [nop,nop,TS val 1569282403 ecr 9770569], length 24
16:30:15.714424 IP 10.244.5.22.40014 > vminkube06.nghs.com.https: Flags [R], seq 836987690, win 0, length 0
16:30:15.714463 IP vminkube06.nghs.com.https > 10.244.5.22.40014: Flags [F.], seq 2436, ack 869, win 127, options [nop,nop,TS val 1569282403 ecr 9770569], length 0
16:30:15.714476 IP 10.244.5.22.40014 > vminkube06.nghs.com.https: Flags [R], seq 836987691, win 0, length 0
16:30:16.832720 IP 10.244.5.22.40018 > vminkube06.nghs.com.https: Flags [S], seq 3198367018, win 64860, options [mss 1410,sackOK,TS val 9771688 ecr 0,nop,wscale 9], length 0
16:30:16.832997 IP vminkube06.nghs.com.https > 10.244.5.22.40018: Flags [S.], seq 1904175543, ack 3198367019, win 65160, options [mss 1460,sackOK,TS val 2997448492 ecr 9771688,nop,wscale 9], length 0
16:30:16.833023 IP 10.244.5.22.40018 > vminkube06.nghs.com.https: Flags [.], ack 1, win 127, options [nop,nop,TS val 9771688 ecr 2997448492], length 0
16:30:16.833583 IP 10.244.5.22.40018 > vminkube06.nghs.com.https: Flags [P.], seq 1:518, ack 1, win 127, options [nop,nop,TS val 9771689 ecr 2997448492], length 517
16:30:16.833809 IP vminkube06.nghs.com.https > 10.244.5.22.40018: Flags [.], ack 518, win 127, options [nop,nop,TS val 2997448493 ecr 9771689], length 0
16:30:16.836583 IP vminkube06.nghs.com.https > 10.244.5.22.40018: Flags [P.], seq 1:1633, ack 518, win 127, options [nop,nop,TS val 2997448496 ecr 9771689], length 1632
16:30:16.836600 IP 10.244.5.22.40018 > vminkube06.nghs.com.https: Flags [.], ack 1633, win 124, options [nop,nop,TS val 9771692 ecr 2997448496], length 0
16:30:16.837474 IP 10.244.5.22.40018 > vminkube06.nghs.com.https: Flags [P.], seq 518:612, ack 1633, win 126, options [nop,nop,TS val 9771693 ecr 2997448496], length 94
16:30:16.837715 IP vminkube06.nghs.com.https > 10.244.5.22.40018: Flags [P.], seq 1633:1785, ack 612, win 127, options [nop,nop,TS val 2997448497 ecr 9771693], length 152
16:30:16.837774 IP vminkube06.nghs.com.https > 10.244.5.22.40018: Flags [P.], seq 1785:1840, ack 612, win 127, options [nop,nop,TS val 2997448497 ecr 9771693], length 55
16:30:16.837796 IP 10.244.5.22.40018 > vminkube06.nghs.com.https: Flags [P.], seq 612:658, ack 1840, win 126, options [nop,nop,TS val 9771693 ecr 2997448497], length 46
16:30:16.837859 IP 10.244.5.22.40018 > vminkube06.nghs.com.https: Flags [P.], seq 658:707, ack 1840, win 126, options [nop,nop,TS val 9771693 ecr 2997448497], length 49
16:30:16.837915 IP 10.244.5.22.40018 > vminkube06.nghs.com.https: Flags [P.], seq 707:742, ack 1840, win 126, options [nop,nop,TS val 9771693 ecr 2997448497], length 35
16:30:16.838049 IP vminkube06.nghs.com.https > 10.244.5.22.40018: Flags [P.], seq 1840:1875, ack 707, win 127, options [nop,nop,TS val 2997448498 ecr 9771693], length 35
16:30:16.838101 IP 10.244.5.22.40018 > vminkube06.nghs.com.https: Flags [P.], seq 742:813, ack 1875, win 126, options [nop,nop,TS val 9771693 ecr 2997448498], length 71
16:30:16.838127 IP vminkube06.nghs.com.https > 10.244.5.22.40018: Flags [P.], seq 1875:1906, ack 742, win 127, options [nop,nop,TS val 2997448498 ecr 9771693], length 31
16:30:16.838312 IP 10.244.5.22.40018 > vminkube06.nghs.com.https: Flags [P.], seq 813:844, ack 1906, win 126, options [nop,nop,TS val 9771693 ecr 2997448498], length 31
16:30:16.838700 IP vminkube06.nghs.com.https > 10.244.5.22.40018: Flags [P.], seq 1906:2160, ack 844, win 127, options [nop,nop,TS val 2997448498 ecr 9771693], length 254
16:30:16.838752 IP vminkube06.nghs.com.https > 10.244.5.22.40018: Flags [P.], seq 2160:2411, ack 844, win 127, options [nop,nop,TS val 2997448498 ecr 9771693], length 251
16:30:16.838888 IP 10.244.5.22.40018 > vminkube06.nghs.com.https: Flags [.], ack 2411, win 126, options [nop,nop,TS val 9771694 ecr 2997448498], length 0
16:30:16.839142 IP 10.244.5.22.40018 > vminkube06.nghs.com.https: Flags [P.], seq 844:868, ack 2411, win 126, options [nop,nop,TS val 9771694 ecr 2997448498], length 24
16:30:16.839210 IP 10.244.5.22.40018 > vminkube06.nghs.com.https: Flags [F.], seq 868, ack 2411, win 126, options [nop,nop,TS val 9771694 ecr 2997448498], length 0
16:30:16.839391 IP vminkube06.nghs.com.https > 10.244.5.22.40018: Flags [P.], seq 2411:2435, ack 868, win 127, options [nop,nop,TS val 2997448499 ecr 9771694], length 24
16:30:16.839444 IP 10.244.5.22.40018 > vminkube06.nghs.com.https: Flags [R], seq 3198367886, win 0, length 0
16:30:16.839476 IP vminkube06.nghs.com.https > 10.244.5.22.40018: Flags [F.], seq 2435, ack 869, win 127, options [nop,nop,TS val 2997448499 ecr 9771694], length 0
16:30:16.839487 IP 10.244.5.22.40018 > vminkube06.nghs.com.https: Flags [R], seq 3198367887, win 0, length 0
16:30:17.995196 IP 10.244.5.22.40026 > vminkube06.nghs.com.https: Flags [S], seq 3974221935, win 64860, options [mss 1410,sackOK,TS val 9772850 ecr 0,nop,wscale 9], length 0
16:30:17.995373 IP vminkube06.nghs.com.https > 10.244.5.22.40026: Flags [R.], seq 0, ack 3974221936, win 0, length 0
^C
55 packets captured
55 packets received by filter
0 packets dropped by kernel
```

**Comment by rbrtbnfgl** [comment]
I am not sure but the connection refused should be related to an ICMP packet.

**Comment by ImNtReal** [comment]
This is from my testing pod:
```
                                                                                  My traceroute  [v0.95]
tmp-shell (10.244.5.22) -> kubernetes.default.svc (10.245.0.1)                                                                                                    2022-10-20T16:57:39+0000
Keys:  Help   Display mode   Restart statistics   Order of fields   quit
                                                                                                                                                  Packets               Pings
 Host                                                                                                                                           Loss%   Snt   Last   Avg  Best  Wrst StDev
 1. kubernetes.default.svc.cluster.local                                                                                                         0.0%   316    0.1   0.1   0.0   0.3   0.0
```

**Comment by rbrtbnfgl** [comment]
But I think that the `Connection refused` error is not related to the networking. The server is closing the connection for some reason. If it was a networking error and the packet is dropped you should get a timeout error.

**Comment by ImNtReal** [comment]
After digging in some more, I discovered that when I added my second and third control-plane nodes, they had kube-apiservice listening on the default 6443 instead of 443 which I defined when I created the cluster on the first node. After changing all references I could find from 6443 to 443 on the other two nodes, now, it seems all connection attempts from inside the cluster are returning "connection refused"

**Comment by ImNtReal** [comment]
I gave up on running the apiserver on port 443. I redeployed with the default, 6443. Now, everything seems to be working.
